{
  "$schema": "https://json-schema.org/draft/2020-12/schema",
  "$id": "https://gobl.org/draft-0/bill/order",
  "$ref": "#/$defs/bill.Order",
  "$defs": {
    "bill.Order": {
      "properties": {
        "$regime": {
          "$ref": "https://gobl.org/draft-0/tax/regime-code",
          "title": "Tax Regime",
          "description": "Country code that identifies the tax regime applicable to the document.\nIt determines which country-specific tax rules, normalizations, and validations are applied.\nIt may be determined automatically via normalization of a supplier or issuer tax identity\ncountry code."
        },
        "$addons": {
          "$ref": "https://gobl.org/draft-0/tax/addon-list",
          "title": "Addons",
          "description": "Addons defines a list of keys used to identify tax addons that apply special\nnormalization, scenarios, and validation rules to a document."
        },
        "$tags": {
          "items": {
            "$ref": "https://gobl.org/draft-0/cbc/key"
          },
          "type": "array",
          "title": "Tags",
          "description": "Tags are used to help identify specific tax scenarios or requirements that may\napply changes to the contents of the document or imply a specific meaning.\nConverters may use tags to help identify specific situations that do not have\na specific extension, for example; self-billed or partial invoices may be\nidentified by their respective tags."
        },
        "uuid": {
          "type": "string",
          "format": "uuid",
          "title": "UUID",
          "description": "Universally Unique Identifier."
        },
        "type": {
          "$ref": "https://gobl.org/draft-0/cbc/key",
          "oneOf": [
            {
              "const": "purchase",
              "title": "Purchase Order",
              "description": "A purchase order is a document that a buyer sends to a seller to request goods or services."
            },
            {
              "const": "sale",
              "title": "Sales Order",
              "description": "A sales order is a document that a seller sends to a buyer to confirm the sale of goods or services."
            },
            {
              "const": "quote",
              "title": "Quote",
              "description": "A quote is a document that a seller sends to a buyer to provide a price for goods or services."
            }
          ],
          "title": "Type",
          "description": "Type of the order."
        },
        "series": {
          "$ref": "https://gobl.org/draft-0/cbc/code",
          "title": "Series",
          "description": "Series is used to identify groups of orders by date, business area, project,\ntype, customer, a combination of any, or other company specific data.\nIf the output format does not support the series as a separate field, it will be\nprepended to the code for presentation with a dash (`-`) for separation."
        },
        "code": {
          "$ref": "https://gobl.org/draft-0/cbc/code",
          "title": "Code",
          "description": "Code is a sequential identifier that uniquely identifies the order. The code can\nbe left empty initially, but is **required** to **sign** the document."
        },
        "issue_date": {
          "$ref": "https://gobl.org/draft-0/cal/date",
          "title": "Issue Date",
          "description": "When the invoice was created.",
          "calculated": true
        },
        "issue_time": {
          "$ref": "https://gobl.org/draft-0/cal/time",
          "title": "Issue Time",
          "description": "IssueTime is an optional field that may be useful to indicate the time of day when\nthe order was issued. Some regions and formats may require this field to be set.\nAn empty string will be automatically updated to reflect the current date and time,\nwhile an explicit time such as midnight (00:00:00) is respected. Otherwise the field\ncan be left with a nil value.",
          "calculated": true
        },
        "op_date": {
          "$ref": "https://gobl.org/draft-0/cal/date",
          "title": "Operation Date",
          "description": "Date when the operation defined by the invoice became effective."
        },
        "value_date": {
          "$ref": "https://gobl.org/draft-0/cal/date",
          "title": "Value Date",
          "description": "When the taxes of this invoice become accountable, if none set, the issue date is used."
        },
        "currency": {
          "$ref": "https://gobl.org/draft-0/currency/code",
          "title": "Currency",
          "description": "Currency for all invoice totals.",
          "calculated": true
        },
        "exchange_rates": {
          "items": {
            "$ref": "https://gobl.org/draft-0/currency/exchange-rate"
          },
          "type": "array",
          "title": "Exchange Rates",
          "description": "Exchange rates to be used when converting the invoices monetary values into other currencies."
        },
        "contracts": {
          "items": {
            "$ref": "https://gobl.org/draft-0/org/document-ref"
          },
          "type": "array",
          "title": "Contracts",
          "description": "The identification of contracts."
        },
        "preceding": {
          "items": {
            "$ref": "https://gobl.org/draft-0/org/document-ref"
          },
          "type": "array",
          "title": "Preceding Details",
          "description": "Key information regarding previous order documents."
        },
        "identities": {
          "items": {
            "$ref": "https://gobl.org/draft-0/org/identity"
          },
          "type": "array",
          "title": "Identities",
          "description": "Additional codes, IDs, SKUs, or other regional or custom identifiers that may be used to identify the order."
        },
        "period": {
          "$ref": "https://gobl.org/draft-0/cal/period",
          "title": "Period",
          "description": "Period of time in which the order is valid."
        },
        "tax": {
          "$ref": "https://gobl.org/draft-0/bill/tax",
          "title": "Tax",
          "description": "Special tax configuration for billing."
        },
        "supplier": {
          "$ref": "https://gobl.org/draft-0/org/party",
          "title": "Supplier",
          "description": "The entity supplying the goods or services and usually responsible for paying taxes."
        },
        "customer": {
          "$ref": "https://gobl.org/draft-0/org/party",
          "title": "Customer",
          "description": "Legal entity receiving the goods or services, may be nil in certain circumstances such as simplified invoices."
        },
        "buyer": {
          "$ref": "https://gobl.org/draft-0/org/party",
          "title": "Buyer",
          "description": "Party who is responsible for issuing payment, if not the same as the customer."
        },
        "seller": {
          "$ref": "https://gobl.org/draft-0/org/party",
          "title": "Seller",
          "description": "Seller is the party liable to pay taxes on the transaction if not the same as the supplier."
        },
        "lines": {
          "items": {
            "$ref": "https://gobl.org/draft-0/bill/line"
          },
          "type": "array",
          "title": "Lines",
          "description": "List of lines representing each of the items to be ordered."
        },
        "discounts": {
          "items": {
            "$ref": "https://gobl.org/draft-0/bill/discount"
          },
          "type": "array",
          "title": "Discounts",
          "description": "Discounts or allowances applied to order totals"
        },
        "charges": {
          "items": {
            "$ref": "https://gobl.org/draft-0/bill/charge"
          },
          "type": "array",
          "title": "Charges",
          "description": "Charges or surcharges applied to order totals"
        },
        "payment": {
          "$ref": "https://gobl.org/draft-0/bill/payment-details",
          "title": "Payment Details",
          "description": "Information on when, how, and to whom a final invoice would be paid."
        },
        "delivery": {
          "$ref": "https://gobl.org/draft-0/bill/delivery-details",
          "title": "Delivery Details",
          "description": "Specific details on delivery of the goods to copy to the final invoice."
        },
        "totals": {
          "$ref": "https://gobl.org/draft-0/bill/totals",
          "title": "Totals",
          "description": "Summary of all the order totals, including taxes (calculated).",
          "calculated": true
        },
        "notes": {
          "items": {
            "$ref": "https://gobl.org/draft-0/org/note"
          },
          "type": "array",
          "title": "Notes",
          "description": "Unstructured information that is relevant to the order, such as correction or additional\nlegal details."
        },
        "complements": {
          "items": {
            "$ref": "https://gobl.org/draft-0/schema/object"
          },
          "type": "array",
          "title": "Complements",
          "description": "Additional complementary objects that add relevant information to the order."
        },
        "meta": {
          "$ref": "https://gobl.org/draft-0/cbc/meta",
          "title": "Meta",
          "description": "Additional semi-structured data that doesn't fit into the body of the order."
        },
        "attachments": {
          "items": {
            "$ref": "https://gobl.org/draft-0/org/attachment"
          },
          "type": "array",
          "title": "Attachments",
          "description": "Attachments provide additional information or supporting documents that are not included\nin the main document. It is important that attachments are not used for alternative\nversions of the PDF, for that, see \"links\" inside the envelope headers."
        }
      },
      "type": "object",
      "required": [
        "issue_date",
        "currency",
        "supplier"
      ],
      "description": "Order documents are used for the initial part of a order-to-invoice process where the buyer requests goods or services from the seller.",
      "recommended": [
        "$regime",
        "series",
        "code",
        "lines"
      ]
    }
  }
}