{
  "$schema": "https://gobl.org/draft-0/bill/invoice",
  "$regime": "AR",
  "uuid": "3aea7b56-59d8-4beb-90bd-f8f280d852a0",
  "code": "0001-00000123",
  "issue_date": "2025-01-15",
  "currency": "ARS",
  "supplier": {
    "name": "Proveedor Ejemplo S.A.",
    "tax_id": {
      "country": "AR",
      "code": "30712345671"
    },
    "addresses": [
      {
        "street": "Av. Corrientes 1234",
        "locality": "Buenos Aires",
        "region": "Ciudad Autónoma de Buenos Aires",
        "code": "C1043",
        "country": "AR"
      }
    ],
    "emails": [
      {
        "addr": "ventas@proveedorejemplo.com.ar"
      }
    ]
  },
  "customer": {
    "name": "Cliente Comercial S.R.L.",
    "tax_id": {
      "country": "AR",
      "code": "30987654321"
    },
    "addresses": [
      {
        "street": "Av. Santa Fe 2500",
        "locality": "Buenos Aires",
        "region": "Ciudad Autónoma de Buenos Aires",
        "code": "C1123",
        "country": "AR"
      }
    ],
    "emails": [
      {
        "addr": "compras@clientecomercial.com.ar"
      }
    ]
  },
  "lines": [
    {
      "quantity": "10",
      "item": {
        "name": "Servicios de consultoría",
        "price": "50000.00"
      },
      "taxes": [
        {
          "cat": "VAT",
          "key": "standard",
          "rate": "general",
          "percent": "21%"
        }
      ]
    },
    {
      "quantity": "5",
      "item": {
        "name": "Desarrollo de software",
        "price": "100000.00"
      },
      "taxes": [
        {
          "cat": "VAT",
          "key": "standard",
          "rate": "general",
          "percent": "21%"
        }
      ]
    }
  ],
  "payment": {
    "terms": {
      "due_dates": [
        {
          "date": "2025-02-15",
          "percent": "100%"
        }
      ]
    }
  }
}
