{
  "$schema": "https://gobl.org/draft-0/bill/invoice",
  "$addons": [
    "br-nfe-v4"
  ],
  "$tags": [
    "simplified"
  ],
  "uuid": "0193305c-a7be-730d-b552-2093f0df2df7",
  "tax": {
    "ext": {
      "br-nfe-presence": "1"
    }
  },
  "series": "123",
  "code": "1",
  "issue_date": "2024-11-15",
  "currency": "BRL",
  "supplier": {
    "name": "Drogaria Vida Saudável Ltda.",
    "tax_id": {
      "country": "BR",
      "code": "55263640000186"
    },
    "identities": [
      {
        "key": "br-nfe-state-reg",
        "code": "35503304557308"
      }
    ],
    "addresses": [
      {
        "num": "200",
        "street": "Rua Primeiro de Março",
        "street_extra": "Torre A",
        "locality": "Centro",
        "region": "Rio de Janeiro",
        "state": "RJ",
        "code": "20010-000",
        "country": "BR"
      }
    ],
    "emails": [
      {
        "addr": "saudemais@example.com"
      }
    ],
    "ext": {
      "br-ibge-municipality": "3304557",
      "br-nfe-regime": "1"
    }
  },
  "lines": [
    {
      "i": 1,
      "quantity": "2",
      "item": {
        "name": "Caixa de Máscaras Cirúrgicas",
        "price": "10.00"
      },
      "taxes": [
        {
          "cat": "ICMS",
          "percent": "0%",
          "ext": {
            "br-nfe-icms-csosn": "102"
          }
        },
        {
          "cat": "PIS",
          "percent": "0%",
          "ext": {
            "br-nfe-pis-cst": "49"
          }
        },
        {
          "cat": "COFINS",
          "percent": "0%",
          "ext": {
            "br-nfe-cofins-cst": "49"
          }
        }
      ]
    }
  ],
  "payment": {
    "instructions": {
      "key": "card"
    }
  },
  "notes": [
    {
      "key": "reason",
      "text": "Venda de mercadoria"
    }
  ]
}
