{
  "$schema": "https://gobl.org/draft-0/bill/invoice",
  "uuid": "3aea7b56-59d8-4beb-90bd-f8f280d852a0",
  "code": "1234",
  "series": "SETT",
  "currency": "COP",
  "issue_date": "2021-01-01",
  "supplier": {
    "name": "EXAMPLE SUPPLIER S.A.S.",
    "tax_id": {
      "country": "CO",
      "code": "9014514812"
    },
    "ext": {
      "co-dian-municipality": "11001"
    },
    "addresses": [
      {
        "street": "CRA 8 113 31 OF 703",
        "locality": "Bogot치, D.C.",
        "region": "Bogot치",
        "country": "CO"
      }
    ]
  },
  "customer": {
    "name": "EXAMPLE CUSTOMER S.A.S.",
    "tax_id": {
      "country": "CO",
      "code": "9014514805"
    },
    "ext": {
      "co-dian-municipality": "11001"
    },
    "addresses": [
      {
        "street": "CRA 8 113 31 OF 703",
        "locality": "Bogot치, D.C.",
        "region": "Bogot치",
        "country": "CO"
      }
    ],
    "emails": [
      {
        "addr": "benito.ortiz@example.com"
      }
    ],
    "telephones": [
      {
        "num": "3114131811"
      }
    ]
  },
  "lines": [
    {
      "quantity": "1",
      "item": {
        "name": "Servicios Mes de Julio 2022",
        "price": "200000.00"
      },
      "taxes": [
        {
          "cat": "VAT",
          "percent": "19%"
        }
      ]
    }
  ],
  "payment": {
    "terms": {
      "due_dates": [
        {
          "date": "2021-01-01",
          "percent": "100%"
        }
      ]
    }
  }
}
