{
	"$schema": "https://gobl.org/draft-0/bill/invoice",
	"$regime": "JP",
	"uuid": "0192a3b4-c5d6-7e8f-9012-3456789abcde",
	"code": "SAMPLE-001",
	"currency": "JPY",
	"issue_date": "2024-02-01",
	"supplier": {
		"name": "サンプル株式会社",
		"tax_id": {
			"country": "JP",
			"code": "T8700110005901"
		},
		"addresses": [
			{
				"num": "1-1",
				"street": "Chiyoda",
				"locality": "Chiyoda-ku",
				"region": "Tokyo",
				"code": "100-0001",
				"country": "JP"
			}
		]
	},
	"customer": {
		"name": "得意先株式会社",
		"tax_id": {
			"country": "JP",
			"code": "T5021001052461"
		}
	},
	"lines": [
		{
			"quantity": "2",
			"item": {
				"name": "Consulting service",
				"price": "150000"
			},
			"taxes": [
				{
					"cat": "JCT",
					"rate": "general"
				}
			]
		},
		{
			"quantity": "10",
			"item": {
				"name": "Boxed lunch (takeaway)",
				"price": "1200"
			},
			"taxes": [
				{
					"cat": "JCT",
					"rate": "reduced"
				}
			]
		}
	]
}
